<?xml version="1.0" encoding="utf-8" ?>
<Set xmlns:xsi="http://www.w3.org/2001/XMLSchema-instance"
     xmlns="urn:HistoryTrip.Dialogs"
     xsi:schemaLocation="urn:HistoryTrip.Dialogs dialog.xsd">
  <Dialog name="NewCons">
    <Phrase author="Action">
      <Text>Ты Выполнил мой квест, братан?
	  </Text>
    </Phrase>
	  <Phrase author="Игрок" tag="End">
		  <Text>Да!</Text>
	  </Phrase>
    <Phrase author="Олег" lay="1">
      <Text>ружина собрана, сигнальные огни горят ярко. Время двигаться вперед. С нами сила и решимость Перуна. Путь к славе Руси начинается сейчас.</Text>
    </Phrase>
    
  </Dialog>
</Set>