<?xml version="1.0" encoding="utf-8" ?>
<Set xmlns:xsi="http://www.w3.org/2001/XMLSchema-instance"
     xmlns="urn:HistoryTrip.Dialogs"
     xsi:schemaLocation="urn:HistoryTrip.Dialogs dialog.xsd">
  <Dialog name="Oleg">
    <Phrase author="Игрок">
      <Text>Великий Кнаязь Олег. Могу ли я задать вам несколько вопросов о нашей битве с Византией?</Text>
      <Answer line="1">
        <Text>Как проходит подготовка к походу на Византию?</Text>
      </Answer>
      <Answer line="2">
        <Text>Какие земли могут быть нашими союзниками в этой битве?</Text>
      </Answer>
      <Answer line="3">
        <Text>Как мы собираемся действовать в походе против Византии?</Text>
      </Answer>
    </Phrase>
    <Phrase author="Олег" lay="1">
      <Text>Подготовка идет полным ходом. Наши воины полны решимости и готовы отдать свои жизни за русские земли.</Text>
    </Phrase>
    <Phrase author="Олег" lay="2">
      <Text>Союзники - это важная часть нашего замысла. Мы договорились с племенами восточных славян, они обещают нам помочь.</Text>
    </Phrase>
    <Phrase author="Олег" lay="3">
      <Text>Мы зайдем с моря и атакуем на кораблях. Будем применять наши суда для перекрытия морских торговых путей. Также мы направим их на вражеские корабли и гавани, чтобы нанести удар по экономике Византии и ослабить ее оборону.</Text>
    </Phrase>
    <Phrase author="Олег" lay="3">
      <Text>Кроме того, будем внезапно атаковать на различных направлениях, чтобы заставить Византию сдать свои силы и ресурсы. Наша цель - добиться победы в этой войне и защитить наши земли и народ от врага.</Text>
    </Phrase>
    <Phrase author="Игрок">
      <Text>Спасибо, Великий Князь!</Text>
    </Phrase>
  </Dialog>
</Set>